<?xml version="1.0" encoding="UTF-8"?>
<xs:schema xmlns:xs="http://www.w3.org/2001/XMLSchema">
  <xs:element name="clients">
    <xs:complexType>
      <xs:sequence>
        <xs:element name="client" maxOccurs="unbounded" minOccurs="0">
          <xs:complexType>
            <xs:sequence>
              <xs:element name="clientId" type="xs:int"/>
              <xs:element name="firstName" type="xs:string"/>
              <xs:element name="lastName" type="xs:string"/>
              <xs:element name="email" type="xs:string"/>
              <xs:element name="phoneNumber" type="xs:string"/>
              <xs:element name="companyName" type="xs:string"/>
            </xs:sequence>
          </xs:complexType>
        </xs:element>
      </xs:sequence>
    </xs:complexType>
  </xs:element>
</xs:schema>